{
  "verdict": "APPROVED",
  "shield_check": {
    "statement_clarity": {
      "score": 9,
      "issues": [
        "The formal partition definition with split points is precise and unambiguous. Indexing is 1-based and explicitly stated."
      ]
    },
    "constraint_solution_alignment": {
      "score": 9,
      "issues": [
        "N ≤ 10⁵ with O(N log(sum)) ≈ 4.7 × 10⁶ operations comfortably fits the 2-second time limit. The next-slower approach O(N²) with N = 10⁵ gives 10¹⁰ operations, which definitively fails."
      ]
    },
    "solution_correctness": {
      "score": 9,
      "issues": [
        "Monotonicity proof is valid and specific to the greedy feasibility check. Pseudocode handles all edge cases including single elements and large values."
      ]
    },
    "test_coverage": {
      "score": 9,
      "issues": [
        "15 test cases across all 4 categories: 4 basic, 5 edge_case, 3 adversarial, 3 boundary. Each wrong approach has a dedicated adversarial test. Stress test configured with 500 random cases."
      ]
    },
    "pedagogical_value": {
      "score": 9,
      "issues": [
        "Problem clearly teaches binary search on answer with monotonic feasibility. The minimize-the-maximum framing is a standard pattern that transfers to many other problems."
      ]
    },
    "difficulty_calibration": {
      "score": 8,
      "issues": [
        "Appropriately rated at 1400 (medium). The Bloom level 'apply' matches the tier. The insight (recognizing monotonicity) is accessible to the target audience."
      ]
    },
    "story_quality": {
      "score": 8,
      "issues": [
        "The research lab story is neutral, motivating, and naturally suggests the partition structure. It does not reveal the algorithm."
      ]
    },
    "sample_test_quality": {
      "score": 9,
      "issues": [
        "Three samples cover: basic partitioning (sample 1), trivial K=N case (sample 2), and a moderate 3-way split (sample 3). Each has a clear explanation."
      ]
    },
    "subtask_design": {
      "score": 8,
      "issues": [
        "Two subtasks with progressive difficulty: small N (30 pts) allows brute force, full N (70 pts) requires binary search. Point distribution rewards the optimal approach."
      ]
    },
    "overall_elegance": {
      "score": 8,
      "issues": [
        "Clean minimize-the-maximum structure. The greedy feasibility check is simple yet instructive. The problem is a solid educational example of binary search on answer."
      ]
    }
  },
  "sword_check": {
    "ambiguity_found": [],
    "unsolvable_cases": [],
    "weak_test_coverage": [
      "Minor: no test with K = N-1 (e.g., N=5, K=4) to verify near-trivial partitioning. Low severity since the binary search handles this naturally."
    ],
    "wrong_approaches_that_pass": []
  },
  "revision_target": "problem_writer",
  "specific_feedback": "All quality dimensions score ≥ 8. No critical or major Sword findings. The problem is approved as-is. Minor suggestion: consider adding a test with K = N-1 for completeness, but this is not blocking.",
  "round": 1,
  "max_rounds": 2
}
